<?xml version="1.0" encoding="UTF-8"?>
<xs:schema xmlns:xs="http://www.w3.org/2001/XMLSchema" elementFormDefault="qualified">
  <xs:element name="bar">
    <xs:complexType>
      <xs:sequence>
        <xs:element name="ticket" maxOccurs="unbounded">
          <xs:complexType>
            <xs:sequence>
              <xs:element name="fecha" type="xs:date"/>
              <xs:element name="hora" type="xs:string"/>
              <xs:element name="camarero" type="xs:string"/>
              <xs:element name="productos_consumidos">
                <xs:complexType>
                  <xs:sequence>
                    <xs:element name="producto" maxOccurs="unbounded">
                      <xs:complexType>
                        <xs:sequence>
                          <xs:element name="nombre" type="xs:string"/>
                          <xs:element name="precio" type="xs:float"/>
                          <xs:element name="cantidad" type="xs:integer"/>
                        </xs:sequence>
                        <xs:attribute name="numLinea" type="xs:integer" use="required"/>
                      </xs:complexType>
                    </xs:element>
                  </xs:sequence>
                </xs:complexType>
              </xs:element>
              <xs:element name="precio_total" type="xs:string"/>
            </xs:sequence>
            <xs:attribute name="numeroTicket" type="xs:integer" use="required"/>
          </xs:complexType>
        </xs:element>
      </xs:sequence>
    </xs:complexType>
  </xs:element>
</xs:schema>
